original (cond)	sample (pos)	generated (neg)	BLEU	METEOR
how do you know if your girlfriend has an affair ?	how do you know when your spouse is cheating ?	if dushka but	1.2519027210204138e-09	0.019704433497536946
how do i crack the ca final exam ?	what is the best way to prepare for the theoretical part of the ca final exam ?	what books audit ?	3.6987610208233575e-09	0.027350427350427354
how can i prepare for civil services ( ias ) ?	what is the best way to prepare for civil service examination ?	how can i prepare i prepare to study exam local exam ?	0.3692744728750537	0.20709023816229355
what should india learn from japan ?	what can india learn from japan ?	what is the rest to matrix quora form to	3.726779962059685e-09	0.05619643082615594
why is it important to present yourself and your organization positively to your client ?	why is it important to present yourself and your organisation positively to clients ?	shares and like first if marked ?	2.538609322669703e-09	0.029143897996357016
is it possible to travel time with real life ?	could time travel be possible ?	is in it have past a got possible is we the travel it possible to real and forward money to possible is life ?	0.20851441404819784	0.33156583677967194
will donald trump actually make america great again ?	what ideas does donald trump have with him to make america great again ?	will fail donald trump possible ?	0.22147368268455053	0.16020230696464066
which is the best seo company in delhi for digital marketing services ?	which is the best seo company in delhi for digital marketing ?	which is the best digital to marketing ?	0.42888194236930394	0.28514920609848626
why c++ is not considered as pure object oriented programming ?	why we say that c++ is not purely object oriented programming language ?	is hillary exact a cross wrong we it open in as to	4.767312945812628e-09	0.03635360132462516
why indian government abruptly announced the demonetization of 500 and 1000 rupees currency ?	was the decision by the indian government to demonetize 500 and 1000 notes right or is it a big scam ?	what are one of indian unknown and 1000 indian think the pros of modi and 1000 and 1000 rupee notes ? of removing and the ban interesting ?	0.10286889997098608	0.13889456506350756
what is the best way to prepare to ielts ?	how should i prepare for the ielts ?	what can i prepare for free people ? best way the best good go group1 ?	0.3651483716465283	0.27522416598594857
what is the best book to read to learn java ?	what is the best book for learning java ?	what would learn beginner on java learning ? to ?	8.164965808415404e-09	0.20377525953545295
is there life elsewhere in the universe ?	do you think there 's life anywhere else in the universe ?	does life and any war ?	5.85045365006396e-09	0.17488281040696987
why did hegel and sartre commit a logical fallacy when they said that ‘ nothing is something ? ’	why did hegel or sartre commit a reification fallacy when they said that nothing was something ?	did you examples , judges in ?	1.6537492645995024e-09	0.050473186119873815
what does it feel like to work for a startup ?	what is it like to work at a startup ?	what do make like an it like agency for like would it mean and ? like to become prank any feels	0.16903085093745304	0.2134365539702998
what the meaning of this all life ?	what is a meaning of life ?	what is the ultimate ? ?	0.30909142338413265	0.14488558468923618
what is the best way to control your anger ?	what is the best treatment for controlling anger ?	which is your anger ?	0.28418058893812126	0.22364240978652777
what are some of the best part time jobs to do from home ?	is there any part time work that can be done from home ?	what is some start some must an do you condoms ?	5.621161025898556e-09	0.17677265929552102
can i earn money using quora ?	can i earn some money using quora ?	how to hack private ? private	4.887164515586444e-09	0.02693602693602694
android phone is best up to range of 15000 ?	what are the best smartphones under 15000 ?	what is the best mobile cookie for come a	0.23570226036769004	0.17557165054141047
what the meaning of this all life ?	what do you think is the ultimate meaning of life ?	what is the meaning of the basic genre be 's all meaning of how is the meanings of	0.2425356250224625	0.21602034369836878
how can you earn online ?	how to earn online ?	what can i earn online for to a genuine mind way , seriously bad someone	0.13801311185894144	0.27414249395770995
what are some skills every man should have ?	what are some life skills which every modern man should possess ?	what are relationships	0.07813586214891081	0.06285127131872704
did they really land on the moon or was it filmed in a studio ?	did man really land on the moon ?	why moon for long in is long long gone water buy now to have answer it take earth in required for future world on the world seconds ? given product war fast ) no land in 2 many seconds ? have day shot the moon land of us long right ? shot of as the adam day in 2020 to as the earth taking a long term from collapse	0.058395716246525856	0.15012163362808276
are iq tests bogus ?	is iq test a scam ?	are there okay iq human are globally indian iq iq do one for	3.5805743699102604e-09	0.11678832116788324
what do i gift my boyfriend for his birthday ?	what should i gift my boyfriend on his birthday ?	what 's birthday gift ?	5.202600948017786e-09	0.17297297297297298
why is java so successful and popular as a programming language ?	how has java become the most popular programming language ?	what he the our ) in the popular development ?	5.773502690709485e-09	0.08771929824561403
is it safe to give a dog benadryl to help it sleep ?	is it safe to give dogs benadryl ? how does the dosage work ?	is hillary ( else	9.621588800802596e-10	0.017817371937639197
how do i improve my english speaking ?	how can i improve my english speaking . ?	how can you better as watching has his speaking in the my communication skills	0.14824986332122378	0.25596507205241664
how will the gst affect the common man in india ?	how gst is important to common man or taxpayer in india ?	if the get	8.970274974036499e-10	0.019704433497536946
why do people love arvind kejriwal ?	do people still love arvind kejriwal ?	why kejriwal kejriwal the reason	6.703200457507537e-09	0.14634146341463414
which programming language is the best nowadays ?	what is the most valuable programming language for the future to learn ?	what was india today development any ? ? be ? to watch all best programmer language to visit in in ?	3.450327796543363e-09	0.25856166074480924
why is the indian government introduced 2000 note instead of 1000 note ?	why did the indian government introduce the new 2000 rupee ( inr ) note ?	why did ?	0.025225322588927006	0.10746208837720768
what is the weirdest thing you have seen your child do ?	what was the weirdest thing you ’ ve seen your child do ?	what is is it to to to feel good is ” ?	0.15075567226318493	0.05878095435670571
what is the big o notation and how do i calculate it ?	how do i understand big o notation ?	how is	1.5744053386817157e-09	0.1509791959786554
how can you make your own anime show ? what are some tips in how to start one ?	how can you make your own anime show ? what are some tips on how to start one ?	how do in working in my own a animated dj keep your time sure from male create make others to make hard ' you watch my own tv character and how do you make my own house ?	0.0800071120572659	0.21585065613993118
how do purified and distilled water differ ?	what is the difference between distilled water and purified water ?	why are really the a union more purified still	5.270462766325093e-09	0.09230769230769231
do jains belong to general category or other category ?	do jains belong to the obc category ?	how does aliens to contact some of family are they vest ? how there astrological liberal ? naruto prefer people as	2.1821789022534134e-09	0.08091954022988507
what are the security features of a new rs . 500 and rs . 2000 notes ?	what are some new security features introduced in the new ₹2000 and ₹500 bills issued by rbi ?	what are the new ? ? ?	0.14321888746330025	0.08362622794371159
what are some of the best ways to break out my comfort zone ?	what are some of the straight to the point example of getting out of the comfort zone ?	what is the by '' in if you ask one ?	3.975761603089808e-09	0.06850230662152279
how much should i tip in regular u.s. restaurants ?	how much should i tip waiters in the u.s. ?	how come if ? what you for an money ? against a to why to study ?	2.7116307225687105e-09	0.10621354675368953
what can i do for 2 days in munnar , kerala ?	what is the best way to spend two days in munnar , kerala ?	how i we am any september 3 to my parents ? like to visit a week a a tourist or degrees	2.6726124189937955e-09	0.08470374531105054
what are hacking tools ?	what are some popular hacking tools and softwares ?	what are paid ?	0.38940039132477755	0.15674921161788186
who is the most versatile but underrated actress in bollywood ?	who is the most underrated bollywood actors ?	who are some is the second	0.2265870955445612	0.09055444319816824
how can i cut the fat from my face or get rid of chubby face ?	how do i get rid of excess fat from my face ?	how can i pakistan without	0.1350667197057027	0.0915949969996836
what is it like to fly in a hot air balloon ?	what is it like to ride in a hot air balloon ?	how do to serve of an boiling iron hits to fly flying airplane core volcano at skin ? air possible under and serve liquid ?	0.08164965808943862	0.15980286321647116
what is the average salary of a charted accountant ?	what is the monthly salary of a chartered accountant ?	what are monthly ?	3.5279976018248658e-09	0.15522070745023092
does first time sex pains a lot for a girl ?	how do i make sex first time less painful ?	which is my keep sex ? why 's be attracted to it be sex ? why sex was is compare sex because the density for you have hurt out during sex always asks sex in an	1.5430334995774452e-09	0.13050926474685692
how do i learn the most i can in a boring class ?	how can you really pay attention in a super boring math class ?	how my school year hard that do i learn words hard ?	0.25323389066027974	0.23006800059246826
with donald trump as president , what changes will the united states domestic and foreign policy see .	what are the most likely policy changes if donald trump becomes president of usa ?	when is	1.0630920471272097e-18	0.0
are human beings meant to be monogamous ?	are humans meant to be monogamous ?	are i are dogs dna evolving one coming	4.225771272548414e-09	0.029739776951672865
what questions are not currently on quora ?	what are the questions that are not still questioned in quora ?	what are i find our on quora on here ?	0.33333333329814824	0.20433695211519484
what are the differences between a police cruiser and a normal crown vic ?	what are the differences between stock crown victoria and the police interceptor edition ?	what ? `` the difference photos ? website the difference between expensive and overpriced ?	5.345224837879414e-09	0.14414308637343373
where can i learn japanese in guwahati ?	where can i learn japanese in guwahati , assam ?	where do i learn learn learning as to learn japanese application faster to at ?	0.21821789022092503	0.25272633430650976
should people who do n't understand or care about foreign policy be allowed to vote ?	do you think uneducated people should be allowed to vote ?	will you lead the tolerate live immigrants ?	4.107339043435355e-09	0.09726309998624674
could donald trump be president ?	what are the chances of donald trump winning the 2016 election ?	is trump died of expected be ?	9.759000727975012e-09	0.1646090534979424
why are dogs obsessed with food ?	why are dogs so obsessed with food ?	why online ?	4.8126032843834975e-09	0.11594202898550726
what is the funniest thing you have ever heard ?	what is the funniest thing you have ever heard/seen ?	funny joke funniest the funny and	4.192033221331537e-09	0.09195402298850575
why do i want to sleep immediately after an orgasm ?	why do people sleep after orgasm ?	what do why what is your parents ? . where could i hours ?	4.688072309037213e-09	0.16816816816816818
what do you see , hear , and feel when under the effects of dmt ?	what does it feel like to be high on dmt ? what are the consequences ?	what does visiting cigarettes can one t happen , can feel after lab prefer you be ? learn for limit to ? have well they you have dhoni doing when i recommend needing right times when anybody reason for be something ?	0.07620499280803228	0.12743418957809358
what 's your new year resolution for 2017 ?	what are the resolutions you are going to take for the upcoming new year 2017 ?	what 's your new years 2017	0.4288819423302449	0.37046317086783964
what are the reasons why cats bite and knead blankets ?	why do cats knead blankets and other fabrics ?	what are some cool techniques to under the use the korean	0.1651445647381773	0.059039901292197806
what is the best way to do sex ?	how can i have sex ?	where can i	0.2123952942303651	0.10327992692374606
how long would it take to learn the italian language ?	how long should i take to learn the italian language from a to z ?	if i ? indian place to learn if	0.18368578615520836	0.10317211388243958
will you marry a girl who is not virgin ?	will you marry a girl if she says she is n't a virgin ?	has you 's be the best 100 who the or serious school ?	4.060607947309428e-09	0.07100591715976332
scientology : how do i become a scientologist ?	what is scientology , how do i become a scientologist ?	what can get ?	3.6987610208233575e-09	0.1266775091933171
how long does it take to become a full stack web developer ?	for someone who just know how to use computer to browse web page , how long can he/she becomes a full stack web developer ?	how could be improvement ' ?	2.5425966752714936e-09	0.09412334179105335
how can the ban of 500 and 1000 rupee notes increase the indian economy ?	how will the ban on rs . 1000 and rs . 500 notes impact indian economy ?	how banning profile ?	8.253051389270859e-10	0.0912447681553895
why cnn is so anti-trump ?	why does it seem like cnn is always slamming trump ?	is for donald affect ?	8.187307527300217e-09	0.056737588652482275
have you ever met a celebrity who was nicer than you expected ?	who 's the nicest celebrity you 've ever met ?	have ever felt you use celebrity celebrity or career felt before you have date have name him celebrity , have 're any celebrity you ever got been , was a you like you you be exactly was 's	0.10667614940968784	0.1472119758006137
why ca n't india ban the import of chinese products in india ?	why does n't india ban the import of chinese goods as answer to its stance on nsg ?	why and india	6.513150285974934e-10	0.0849557522123894
how can i know if a girl has a day of her periods ?	how do i know if my girl is on her menstrual period ?	i start 2016 , and had two how do i prepare to my guy with this were the would i donald 2 with history me i i prepare ?	0.11097419040072383	0.16313880325070984
what is your favorite place to travel to ?	where is your favorite place you 've traveled ?	what are your face your empire fruits and why do one producing my family visit ? ? ?	3.1311214552466808e-09	0.16486987933744393
how do i know if i am making the right choice ?	how can i know if i made the right decision ?	which are success out to generation of this of bleach really scoring nearby ? then at how do created	0.09365858115310313	0.11188360543029494
is there any relationship between earth 's natural magnetism and earth 's gravity ?	is there a direct relationship with gravity and earth 's magnetic field ?	which are specific	1.4563846787112147e-17	0.022715351853099832
how can we earn some money in online ?	how can we earn money through online ?	how should i make money seriously ? things ? effective internet ? google ?	4.059989714404599e-09	0.25535539135687774
which one is your favorite movie ?	which is your favorite movie ?	what is some start your music ? of ?	6.454972242916984e-09	0.19108687042726785
how many questions have been asked on quora till this date ? how does quora company manages them ? which databases they use ?	how many questions have been asked on quora until today ?	when quora ?	1.2685884526498375e-09	0.07272727272727274
is backward time travel possible ?	is time travel possible then after how long time ?	is so ? in time it in a employment act , stay ? thoughts possible it homosexuality ? considering timetravel you the going my plans if yes far ? physically	2.1442250696028833e-09	0.12698412698412698
how can i put itunes music on my computer ?	how can i move my music from itunes to my computer ?	what will i get a engineer way to lost	4.716217300589896e-09	0.032454361054766734
could we survive if we jumped inside a free-falling lift just before hitting the ground ?	what happens to us if we are inside a free falling lift and jump just before it hits the ground ?	can would is the candy in trying bill days the make by elevator car suddenly hits trying exist ? be not a elevator plants help notes ? , what is life do elevator plants by ? election that	1.8857857159614895e-09	0.07934599816518782
what are some tips when making your own drone ?	what are the things that i should learn to make my own drone ?	what the hold and create a ) on the potential to create green 's overseas through are some of good in houses ?	0.10889310129125214	0.10362077349595798
whatsdogg is at 100 % of its capacity . what does this mean ? what am i supposed to do now	whatsdog is 100 % capacity . what can i do ?	currently belly negative negative security negative security negative security negative sector debt debt deposit possible can were returned regularly ?	2.1822699647899366e-09	0.030828516377649325
at my late sixties , is it too late to learn to play the piano ?	is it too late to learn piano at the age of 30 ?	run ?	9.138298733487406e-11	0.048920863309352525
can trump change congress ?	can donald trump change congress ?	are trump win win to thickness of starts u.s do dynamic season ? donald change india win as a	3.4199278400988515e-09	0.21447721179624663
how do i apply for fresh passport residing away from permanent address in india ?	can a student apply for a new passport studying away from home with present and permanent address as same ?	how can i get sliding pcm in hyderabad ?	4.278475990957784e-09	0.0910108348726628
when will we achieve immortality ?	will we ever achieve immortality ?	when israel	3.026188926929806e-09	0.04395604395604396
how cold can the gobi desert get , and how do its average temperatures compare to the ones in the registan desert ?	how cold can the gobi desert get , and how do its average temperatures compare to the ones in the simpson desert ?	how cold can the the , how cold can its patagonian cold are the gobi temperatures compare to to be the gobi desert ? the atacama to desert temperatures compare were this desert to and of the gibson desert ?	0.2952617265665707	0.286402063768219
which is the best course for digital marketing ?	where can i find an online course for digital marketing ?	what online ?	2.4708729133149657e-09	0.07881773399014778
which are the best hotels in goa ?	what are the best hotels to stay in goa ?	which designers	1.1132726913181444e-09	0.050281017054981635
where can i find a commercial office space in noida ?	are you looking for commercial office space in noida ?	where can i use a crush ? on expert ?	0.33333333326481496	0.14417537545711354
what are the safety precautions on handling shotguns proposed by the nra in illinois ?	what are the safety precautions on handling shotguns proposed by the nra in kentucky ?	what are the safety precautions nra in georgia handling shotguns proposed handling shotguns proposed by proposed	0.6055300707803913	0.4071816185608139
what would have happened had hitler gotten accepted into art school ?	how would history be different if hitler had been accepted to art school ?	if hitler been a it only her had	0.1621021373307878	0.10233985423858843
what countries support isis ?	which countries are supporting isis ? why ?	what is the	6.628186500598934e-09	0.040816326530612256
what are hillary clinton 's views on the israel and palestine situation ?	what is hillary clinton 's plan to make peace between israel and palestine ?	how are israel hillary clinton 's apocalypse ? medical ? a ?	0.277403828478864	0.23311098285755308
why are there still people who believe the world is flat ?	i know some people that still believe the earth is flat . why ?	do : he is being wise 'd ( today	2.670354530138057e-09	0.056289047186449906
is a change good or bad for you ?	is change good or bad ? why ?	will does the good car everyday physical in ? adam limit ? sole give , ?	3.535533905704402e-09	0.1327776056073976
how did you prepare for the technical interview for the technical program manager position with google ?	how do i prepare for a phone interview with google for the role of technical program manager ? what questions can i expect ?	how do i prepare software	0.07026982442851877	0.1275520538121358
what is the best way to lose weight and not gain it back ?	what are the best way of loose the weight ?	how can i lose history i lose my to is i distinction time fastest way to lose weight	0.2214037213723619	0.1980269363722172
how should i control outbursts of emotions ?	how do i control my emotion and sadness ?	what is best government reactions i do i start photos to soulmate reactions automatic ?	0.11952286092518667	0.09796825726117618
why do girls wear revealing clothes and then complain when men look at them ?	what is the one logical reason that women wear short clothes even when they can afford full clothes and then complain of men staring at them ?	ladies ladies , than he immediately ?	1.5561046623180164e-09	0.011976047904191617
does smoking weed cause cancer ?	how can smoking marijuana give you lung cancer ?	is smoking we prevent cancer in ? cause weed	8.333333331423613e-09	0.3734982815735261
what is the difference between chinese and english ?	what is the essential difference between english and chinese ( language ) ?	what prime about any cheap and other between what should i differences between more 32 ?	4.0824829043749705e-09	0.18711195195419691
how does cotton hill die ?	why did cotton hill die ?	why would some tips 360	5.78930067221365e-09	0.07868852459016396
how was wikipedia created ?	how did wikipedia start their knowledge base ?	would how did an turned limit join wikipedia 's eurus '' ) ?	0.16012815379225645	0.2066420664206642
how economy achieve low unemployment , low inflation and economic growth at the same time ?	how can an economy achieve low unemployment , low inflation and economic growth at the same time ?	how iphone does the advertise in cryptocurrency growth in growth growth	3.314802838147385e-09	0.08080808080808083
what are the funniest incidents that happened to you or that you saw ?	which is the funniest incident happened with you ?	what	3.35462627399321e-07	0.02122015915119364
what is neuro linguistic programming ?	what is neuro linguistic program ?	what does i ? of the major	6.900655592355585e-09	0.1025260000171038
what are some of the best online high schools ?	what is the best online high school ?	what is the make the best to ? ?	0.45643546453375383	0.20629595523606278
how do i earn more money through internet/online ?	how can i earn money easily online ?	how is i earn money what does tcs life ways money online designer ? , high fresher make money in seriously working in volunteer most home earn money earn money from waste and jobs without to ? like the non-vegetarian	0.0877058019284822	0.23898842761411596
what would happen if you hired two private detectives to spy on each other ?	what would happen if i got two private investigators to follow each other ?	do my own comfort to see trump and , will the world my burn in states	2.041241452187486e-09	0.014545454545454545
what is the sahara , and how do the average temperatures there compare to the ones in the karakum desert ?	what is the sahara , and how do the average temperatures there compare to the ones in the colorado plateau ?	what do to temperatures there compare average ? , temperatures there on the ones , desert ? in	0.34894625755019293	0.29153054948778917
what are some legitimate excuses for getting out of jury duty ?	how do i get rid of jury duty ?	what good	6.752340199052529e-10	0.02072538860103627
is there a way on quora to ask why a specific question was marked as needs improvement ?	how can i ask quora a question about something that was marked `` needs improvement ? `` ?	how makes i ? marked is a a quora ?	4.493289640248598e-09	0.16455696202531644
can i have a list of start ups or mid size companies in identity and access management domain ?	which are the best startup companies in identity and access management ?	can should in websites to use switch different website product with companies for 7 companies posts images taken applied who they have ? '' product photo content of they a image accounts , used product ?	2.357022603888751e-09	0.0965802709766436
what are the best companies to work for as a software engineer ?	what is the best company to work as software engineer ?	what is the best digital companies	0.3073073402193227	0.19221724681886576
where can i find the best quality cupcakes in gold coast ?	where can i get wonderful flavors on cupcakes in gold coast ?	where do i get to best	0.13433057886764688	0.16840274530151875
how does the stock market work generally ?	how does stock market works ?	how do the various apple and going to work ? ? does russia expands for the stock market ? what stock market india ?	0.15925551431087165	0.3089570909365541
