original (cond)	sample (pos)	generated (neg)	BLEU	METEOR
taking the nation by surprise , the govt of india has put a ban on all ₹500 & ₹1000 notes from this midnight . what 's your opinion ?	what are your views on demonetization of ₹500 & ₹1000 notes in india ?	has be ? is 100 effects of ?	3.4573691486928157e-09	0.036637816328709195
how do i tell the difference between infatuation and love ?	what is the difference between being in love and lust ?	what is the difference between infatuation ?	0.5155147566059136	0.30553007552238376
who should become the next president of usa ?	who is the next president of usa ?	when become as a become any will am next election to become as 2010 ? towards next of a the usa be visit for cm next ?	2.92352673091307e-09	0.19672131147540983
who will be the better president trump or clinton ?	why would hillary clinton be a better president than donald trump ?	which is trump ?	0.09109250638218279	0.16444242445802335
what is the best way to print wedding invitation envelopes ?	what is the best way to print wedding envelopes ?	what are you increase the best programming and you get	0.1825741857975264	0.14111271602480097
what do i do if i dropped my iphone 5c and now it is black and wont turn on ?	what do i do if i dropped my iphone 6 on its side and it wo n't come back on ?	do	5.602796429133214e-12	0.03483309143686502
what will happen to corruption money deposited by indian politicians in swiss bank after banning 500 and 1000 rupees notes ?	what will be the effect of banning 500 and 1000 notes on people having money in swiss banks ?	do new	1.4387386330455172e-19	0.017755856966707766
how do i prepare for the gate 2015 for metallurgy ?	how do i prepare for gate metallurgy ?	what are the ? a ?	5.85045365006396e-09	0.07284792626728111
in the pokemon ranger and the temple of the sea movie , why is manaphy crying ?	why is manaphy bipolar in pokémon ranger and the temple of the sea ?	what important pokemon ranger , `` had throughout temple an . why do in japanese choice ?	0.16042223696076896	0.1947946663496104
what is stem education ?	what does stem education stand for ?	how can good does the freedom ?	6.900655591369778e-09	0.10666666666666667
what are the best smartphones tech gadgets ?	what are some of the best smartphones technology gadgets ?	what are some amplifier that website gadgets ? smartphones gadgets ?	0.4045199174393321	0.2588995458115586
what is the difference between ms. and miss ?	what are the differences between mr. , mrs. , ms. and miss ?	what is the differences between nuclear and	0.5680634379421358	0.2402133218520334
is there anyway to short the toronto housing market ?	how do i go about shorting the toronto housing market ?	?	1.2340980390156643e-07	0.023323615160349857
why is mamata banerjee high on her heels to force modi to take back his move to ban 500 & 1000 rs ?	why mamta not supporting ban on 500 & 1000 rupees notes ?	why ca dogs follow against you ? or they back of ?	4.7673129454153526e-09	0.0879725085910653
how do you know the man really love you or not ?	how you know the man is truly in love ?	how would move if we know they fallen in make attracted when know say make number was fallen in	2.9617443886352513e-09	0.15814090334727898
how does one become an orchestra conductor ?	how do you become a conductor ?	how do i become by become a way in a accept i	0.2461829819372178	0.29215269848460274
how do you earn money from internet ?	how can i earn money easily online ?	how can you make money ?	0.29252268250319813	0.32920157762076285
what are the best smartphones under 15k in 2016 ?	which is the best smartphone i can buy under 15000 in july 2016 ?	which software	4.0955013555354697e-10	0.04573432934256308
what would happen if i got two private investigators to follow each other ?	what will happen if i hire two private detectives to follow each other ?	which other , and hacks they	1.5218787859546417e-09	0.01716738197424893
what are the left and right wings of the political ideological spectrum ?	how does the political left differ from the political right ?	what are and	0.049132219503038595	0.06176063407064011
should people over 95 not be allowed to vote ?	should people over 94 not be allowed to vote ?	does someone	1.2951112443799125e-17	0.0
what is best super power ?	what is the best super power ?	what are you ever	5.536842066052537e-09	0.07377083860834356
what is the most liked song ?	what 's the most generally liked song ?	what are some the best name who is the most you that ?	0.25318484175062944	0.23078432402307741
is climate change unstoppable now ?	is climate change stoppable ?	what constitutes irreversible ?	7.109445940997322e-09	0.037914691943127965
how can i lose 4kg weight ?	what are the best was to lose weight ?	what i lose what should i lose	0.2672612418328825	0.14999868884212633
what is the best thing to do to start being involved in open source projects ?	how do i participate or contribute in open source projects ?	what is the best to to learn site along to learn of ?	0.36689969282327245	0.12895796019928601
where can i get designer collection of affordable floor tiles in sydney ?	where can i get huge selection of floor tiles in sydney ?	can i get large collections of them collection of floor tiles sydney , and floor tiles collection tiles ? korean wall tile and like like mats tiles in sydney for better iphone collection price collection or floor tile of floor floor get very stylish ceramic found wide variety of a wedding durable watch bath , supplier of collection collection ? collection collection tiles in collection wide variety for floor tiles sydney	0.11867816581770188	0.19459772121006974
what is your favorite music video ?	what are your favorite music and video clips ?	what is the strongest of nanshan ? ? ?	0.20412414518515326	0.09117045981856395
what would be hillary clinton 's policy on india ?	what is hillary clinton 's foreign policy outlook with regard to india ?	what you join ?	2.88059797941122e-09	0.0469208211143695
how does emdrive space engine work ?	how does emdrive work ?	how when big jwst ?	9.999999995750004e-09	0.12598425196850394
what 's your favorite tv show and why ?	what 's your favourite tv series ?	what ? why are tv show	0.34557471697454434	0.24936561177583816
which is the best university in india to do distance mba ?	which is the best institute for a distance mba in india ? why ?	which is business is truly your new university for for kerala from follow	0.16012815379225645	0.0924917708304272
will saina nehwal win gold medel in rio olympics 2016 ?	will india win a single medal in rio olympics 2016 ?	open project reserves in delhi look to fill and a a fight lanes	3.5805743699102604e-09	0.03125
what is the trick to maintaining long distance relationships ?	what does it take for a successful long distance relationship ?	has person ?	1.2519027210204138e-09	0.06853282414086076
is it true that every rs . 2000 currency note is embedded with a *ngc ( nano gps chip ) . and what if this is true ?	are the notes of rs . 2000 really embedded with a gps chip ?	how is the chip ?	0.07392391010230379	0.11015841112244486
is it too late to start medical school at 32 ?	what age is too old to get a medical md ?	is age for	1.2685884526498375e-09	0.07881773399014778
what is the difference between goal and dream ?	what 's the difference between a dream and a goal ?	what is the evolutionary love	0.24610760928283607	0.0984218473944041
how can i prevent myself from zoning out during lectures ?	how should i avoid sleeping during lectures ?	how do for yourself control earth is the various forehead image how plan from my forehead of during sex ?	3.244428422448761e-09	0.14654205607476636
how cold can the gobi desert get , and how do its average temperatures compare to the ones in the dasht-e margo ?	how cold can the gobi desert get , and how do its average temperatures compare to the ones in the great sandy desert ?	how cold gobi its average temperatures compare to , and how do the gobi atacama desert get desert ?	0.5990696706664616	0.3925393700338893
which is better : computer science or information technology ?	which one is better , information technology or computer science ?	what are i ?	2.036890365113941e-09	0.06069161683865287
what should i do if my puppy throws up white foam ?	how do i stop my dog from throwing up white foam ?	how do you	0.028744577302790165	0.11533271517641662
what are the strange phobias people have ?	what are the different phobias people can have ?	what are some some are some people whose side habits , on ?	0.16012815379225645	0.13288812052814064
what is the best way to learn and practice c programming ?	what 's the easiest way to learn c ?	how can anyone learn coding ? to learn ? and ?	0.17412147460524838	0.14796326854630634
what is the best contribution scotland has made to the world ?	what contributions have scotland made to the world ?	what have comfortable is the five and	0.2319109274149018	0.07453416149068325
is there any way to see all of the topics available on quora ?	where can i get a list of all the topics on quora ?	how can you come find ?	2.5425966752714936e-09	0.07068869614463355
how do i transfer money to bank accounts ?	how do i transfer money to a bank account ?	how do i any make best one	0.284031718971068	0.17786693336308973
why is life so unfair & unjust ?	why is life so unfair ?	why is be	0.2123952942303651	0.17449120073874905
what are the similarities between donald trump and hitler ?	what are some similarities between donald trump and adolf hitler ?	what is donald trump life difference between the similarities between usa ? be ?	0.33968311021818254	0.35103165860245317
how do i spray paint a nerf gun ?	what are some of the best ways to paint a nerf gun ?	how do i good gun ? on ? ? create prevent a rid from walmart witch from	0.2572478776981582	0.24814008416744182
why do people like rock `` music '' ?	why do people like rock music ?	what is is are a the `` to best source rule i can one ?	3.0860669990287532e-09	0.07323943661971831
how are international students from hong kong going to be affected after donald trump becomes president ?	how would it affect indian students studying/working in the us if trump becomes the president ?	are us after for indian students the big clinton their public with successful accept recently donald becomes the effect after of	0.2070196677926018	0.1826077661902395
does reality have to exist ?	does reality exist ? ( that old chestnut )	why are loop in career from system i	1.1792860905377833e-16	0.0
what happens to upper management and regular employees if a company is merged with a competitor ?	what happens to employees after a company being acquired ?	what should i do us	2.6013004740088944e-09	0.023655396803237624
which book is best for study of gre ?	what is the best book to study for the gre ?	what is the ? book ever book for gre the gre to to study in ?	0.40824829043749705	0.36031192462430617
how many times a day do a clock ’ s hands overlap ?	how many times does the hands of the clock overlap in a day ?	when how much take a day ?	0.18521149405901446	0.1377065692316614
is it possible to have ovulate 2 times in 1 month ?	is possible to ovulate 2 times in a month ?	is it true ever ?	0.14247909484635526	0.07289064684660884
which fda-approved supplements can help me lose weight and build muscles ?	what supplements can help me build muscle and burn fat ?	what are every ?	2.243411962079365e-09	0.03611738148984199
where can i get pest control service provider in blue mountains ?	where can i get affordable pest control service in blue mountains ?	how can i control the best ? nuclear and in waverly company its pest in waverly company company to support service the australian	0.11761799221901122	0.17453630576097862
is it worth upgrading from the xbox one to the xbox one s ?	should casual gamers upgrade from the xbox one to the xbox one s ?	is on	5.5426583594732444e-11	0.021052631578947368
what does it mean to be truly happy ?	what does it mean to be happy ?	does you stay mean to give about ?	0.26726124184322303	0.26168706681201664
how the members of arya samaj differ from other hindus or if they are hindu at all ?	how is arya samaj different from mainstream hinduism ?	what are the play ?	5.503133441363796e-09	0.0424778761061947
how can something exist in two locations at the same time ?	in quantum physics , how can an object exist in two locations simultaneously ?	when seeing	4.764448008373334e-18	0.0
now that donald trump is president , can he be forced to release his tax returns ?	even though mr. trump is president , is he required to disclose his tax return after audit ?	how say trump if ?	9.071795325085745e-10	0.053872053872053884
what is the best short movie you have seen ?	which is the best short movies you have ever seen ?	what is the most emotional favorite books are your told	0.25819888969408705	0.172306392114303
which is the best quickbooks error support number ?	which is the best quickbooks hosting support number in new york ?	what is the best prominent the best quickbooks customer for ?	0.33718478568160215	0.2276974554717821
how should i proceed in my life ?	how should i proceed in life ?	how do i mathematics and with poems ? physics ?	5.773502691286834e-09	0.12698412698412698
how do we make money online ?	what is best way to make money online ?	how	2.4787521729482488e-06	0.08053691275167785
what is the nicest thing that has happened to you for being nice ?	what is the best thing that ever happened to you for being nice ?	what is the nicest thing	0.16529888815133464	0.23384780763864113
which mba stream is better to pursue a mechanical engineer as fresher ?	which mba stream is best for a mechanical engineer ?	what is hillary war	2.036890365113941e-09	0.02197802197802198
why china and pakistan friendship is so strong ?	why do china and pakistan have such a good relationship ?	why ? could permanently ? then like given hollywood war ?	4.2640143263175525e-09	0.1012524719841793
what are the requirements to become a data analyst ?	how do i become a data analyst ?	what is the raspberry and	5.488116358607818e-09	0.09320383649216109
does jio sim qork in 3g mobile ?	can jio sim support 3g mobile ?	do here ?	3.403024417548223e-09	0.025806451612903226
how can i be a better christian ?	how can l better christian ?	how can more to get to person someone actually	0.16666666664699087	0.145122325009138
why does it hurt to love someone ?	why does unconditional love hurt ?	why nobody is down every me	5.773502689875535e-09	0.12176814289313653
how do i move on from breakup ?	how do i move on after a very bad breakup ?	what is other	7.710814191093513e-17	0.11502413266089442
what are some good names for pet fish ?	what are some good names for a fish ?	what are good halloween pet for german best names ? names pet photos good pet names names ? pet pet topics	0.12909944486727937	0.24271455019886085
what does jimmy wales think of people who say wikipedia is a bad source for correct information ?	what does jimmy wales think about the relatively widespread belief that wikipedia is an unreliable source ?	when would russia have about indian feminist ?	1.940169584886136e-09	0.023845007451564832
what are some entry level it jobs ?	what are some entry-level it jobs ?	what is the ?	6.09822597026799e-09	0.10006869669685581
which is the best bike in india under one lakh for long highway ?	which is the best bike in india under one lakh for long highway cruising ?	what is some of . olympics try ?	2.8229300889126873e-09	0.03839131081422342
what is the difference between ac current and dc current ?	what is ac and dc currents ?	what has awesome difference about awesome and poewr ? usa ? ?	5.504818825152218e-09	0.12310039828584045
is the superfluid dark matter proposed by justin khoury what ripples when galaxy clusters collide and what waves in a double slit experiment ?	does superfluid dm ripple when galaxy clusters collide and wave in a double slit experiment even though physics is too screwed up to figure it out ?	when galaxy in an gr is the slit experiment relate gr qm ?	0.16829196269280633	0.13168145797493191
what is a way to make money online ?	how can i make money online easily ?	what should this '' online to make money	0.42257712725484126	0.29916848786035216
who is the most popular writer at quora ?	who are the people with the most followers on quora ?	who quora you all best most ? . as one intelligence have you most writer	4.879500364405748e-09	0.2595803052944605
why do minions love bananas ?	why do the minions in despicable me love bananas ?	what is bananas ?	0.2476151048074771	0.13177094124753808
what do most people always complain about ?	what do people often complain about ?	what is the reason	4.31209693678441e-09	0.08921456722595963
can i take a 3 month vacation from my software engineering job after working for 2 years and get a job in another company easily when i come back ?	can i take a 3 month vacation from my software engineering job after working for 2 years and come back easily ?	should she expect , should i i , what safe to one online cat ? take citizens money knowledge after ?	3.2898770470247353e-09	0.051118210862619806
how possible is surviving a nuclear war ?	could our species survive an all out nuclear war ?	what cheapest stay iii ?	3.8806842931124116e-09	0.02359882005899705
what is quickbooks tech support number in arizona ?	what is the quickbooks customer support phone number usa ?	which is proavisor arizona las vegas ?	6.3511423138542446e-09	0.12252429156303839
what can substitute red wine in cooking ?	using common household ingredients , how can i substitute for red wine in cooking ?	which better shepherd/golden whipping cream : food use for cooking you describe soda from you resistant beverage	2.7116307225687105e-09	0.05896805896805897
how does paytm earn money after giving cashbacks ?	how does paytm earn by giving extra cash back on already discounted items ?	what is growing beat fast hack later idea is life instagram but easy from paytm ? earn money one beneficiary years resolutions been	0.08891084489092392	0.22865433164836235
what work do technical assistants do in isro ?	how is technical assistant job in isro ?	what work overpriced work ? software software networking sources best scope software department ( scm ? networking software game proposal work your supply ?	0.07372097807431013	0.08227168565579436
how can i self-publish a book in korea ?	how can i self-publish a book in south korea ?	how can developing to get weight 100 a south national go ?	0.19462473602342495	0.16150301057405478
what will be the consequences of 500 and 1000 rupee notes banning ?	what is the use of banning 500 and 1000 rupee notes and introducing new 500 and 2000 rupee notes ?	if the ban notes currency notes and 1000 rupee note league of rupee notes your effect is the india ban 500 and 1000 notes ban is the all between ban notes and 1000 currency notes will changing 500 & 500 and 1000 the most implications of denominations rupee note will banning 1000 notes and 1000 notes really discontinued the ban of pm 1000 rs.1000 notes	0.15887222732309736	0.2346998600532715
what were the major effects of the cambodia earthquake , and how do these effects compare to the cascadia earthquake in 1700 ?	what were the major effects of the cambodia earthquake , and how do these effects compare to the peru earthquake in 1687 ?	what were a in	0.004325847599217157	0.0330506969009344
how do you recover a disabled google account ?	how do you enable a disabled google account ?	how can i best reset over	3.5018063953428727e-09	0.13150985927094555
how do i get internship at iits ( ug student ) ?	how do i get an internship in iit ?	how do i get internship my apply manager can an internship	0.47685129693678713	0.3592559842185179
what causes frost in a freezer ?	what causes frost in freezer ?	is cigarettes ? what were you mean ?	5.976143045871594e-09	0.06666666666666665
where can i found best quality fire rated shutters in sydney ?	where can i found fire-resistant roller shutters in sydney ?	what are i best good in red ?	6.5820679522827e-09	0.09266409266409267
why is my puppy throwing up yellow liquid ?	what should you do if your dog were to vomit yellow foamy liquid ?	how do i shift be good if does	5.273927726724911e-09	0.0761666126160823
what are the pros and cons of getting braces ?	what are the pros and cons of braces ?	what do be ? ?	4.493289639262571e-09	0.0731839617448534
what are the best heist movies from indian cinema ?	which is the best heist bollywood movie ?	what is the best ? show in	0.42299310267594614	0.20346898809606773
how can i just be myself ?	how can i always be myself ?	how i get aways i to approach being through a man ?	4.767312945812628e-09	0.13377926421404682
what is the best book for cds ( ota ) exam . ?	which is the best book for preparing for cds ( ota ) exam ?	who are best day trek	1.4276239691129877e-09	0.05660377358490566
which one is the best webhost in india ?	which is the best webhosting in india ?	which is the india india ?	0.5066641484618783	0.26143854693374124
freedom in media : why have indian government and media banned the australia journalist report on the true india-china war for over 50 years ?	why has india banned the australia journalist ’ s report from publishing on the true india and china war in 1962 for over 50 years ?	how could other if india-china quora compare to us get a only impact india-china war india-china results does arnab and show , indian as body and the impact india-china support that n't the if the chairmanship of this , kejriwal riots on india-china results with the indian climate mr.	0.05455447255787318	0.11367079330132562
why do n't many people posting questions on quora check google first ?	why do so many people ask google-able questions on quora ?	why do	0.011108996524356088	0.11603311628072684
why should we go to school ?	why do we need school ?	what brand mode ? why happens like but	5.976143045871594e-09	0.1095890410958904
which are some of the best horror movies of all time ?	what are good horror movies to watch ?	what is the list on similar	5.85045365006396e-09	0.06978291261984365
what are some of the funniest movies ?	what is the funniest movie you have ever watched ?	what are the the most inspirational way with ? ?	0.21081851063455723	0.1376341248327171
is time travel possible in next 5 years ?	is time travel already possible on earth ?	is it around when family say our three possible impact able for possible it be a right time travel possible at reality spouse age then him	0.1109400392406936	0.16295766721443938
how should i study	how do you study effectively ?	was sold department department survey from myself tomorrow 108 delhi instrument wish to ? with topcoder other citizen of ao gym gym eyes talk exercising hair england england england prince strategies efficiently related numbers harmful shows accounts discrimination autism india india india air korean brand bar back speaker go england korean look oil oil oil oil oil oil canola for guarantee * examination to cgpa studies study study studying online prices plan plan average average average average average average average average average average average average average average average average average average average average average average average average	4.63439998595238e-10	0.048438978240302744
what were the best movies of 2016 ? why ?	what is the best film of 2016 ?	which is the the best all ?	0.3783365326387855	0.21443658268796567
what were the best pc games in 2016 ?	which is the best pc game of 2016 ?	what ? versions of computer from be the have versions of after chemistry versions of ? jack ?	3.6155076301041677e-09	0.0869382836014577
how do i choose a profession ?	how can an individual choose the right career ?	how do i become possible ?	0.4371212829630446	0.25733045765512486
how can i get a hacker ?	how do i get in touch with hackers ?	how is i shot hacker	8.209710382242107e-09	0.28584956152517116
why is manaphy complaining ?	why is manaphy so whiny ?	why was whining ? ?	9.999999995750004e-09	0.20040459952641346
what career choice do i have after completing a b.tech in mechanical engineering if i am interested in space research ?	what are the best option after completing my b.tech in mechanical engineering ?	im career want i . an m.tech ?	3.917712502522235e-09	0.07822346788157504
how can the big bang be created by vacuum fluctuations if time did n't exist before the big bang ?	if time started because of the big bang happening then how could the big bang start because there was no time for the big bang to start ?	if there at , was ?	1.119735834615333e-09	0.04626621422995789
how can i delete my instagram account if i forgotten the email i used ?	how can i delete my instagram account if i do n't know my old password or email ?	how do i flush acne in prevent address ? get get ?	4.2871572113374965e-09	0.0785276073619632
anybody wants know to know how you can make an extra $ 1000 a month ?	how do i make $ 1000 as extra income/month apart from the regular job ?	how is should differently ? ? in i am 1000 1000 help all the notes ?	4.564354645296331e-09	0.09486166007905139
should we be using our real names on reddit or not ? why ?	do you suggest using my real name on reddit.com ?	can i find ( more dark sides can any lifetime can you time dark most ?	2.8867513457616934e-09	0.03501712078987006
which is the best song of lucky ali and why ?	what is your favorite song of lucky ali and why ?	which is the very compare to buy time	0.22496822454112353	0.07794812976599422
why did ecuador cut julian assange 's internet access ?	why has ecuador cut off assange 's internet ?	did ?	9.54925108725713e-10	0.06794055201698514
