original (cond)	sample (pos)	generated (neg)	BLEU	METEOR
what langauges i should learn to become programmer ?	what should i learn if want to become a programmer ?	what programmer what should i learn ?	0.4919573682190146	0.2894967648620154
which iphone should i get my 12 year old girl ?	which iphone should i get my 12.5 year old girl ?	what is previous eventually be into men feel to best free iphone recommend on ? ) can be a ?	2.294157338587892e-09	0.0600375234521576
what is the most scary horror movie have you watched ?	what are the top 10 most scary horror movies list of all time ?	what are the scary series to of 2	0.2904327290245407	0.12450537556471644
do you think zodiac signs affect a persons personality ?	does your zodiac sign really affect your personality ?	is and it ? 'm they be ?	3.729230059054939e-09	0.06061347557347241
has anyone actually travelled in time ?	has anyone ever travelled through time ?	what is it ) with realized you on caste or next satisfied a myntra a ever denial right its ?	2.294157338587892e-09	0.0881542699724518
how is object-oriented programming different from procedure oriented programming ?	what 's object oriented programming really and what makes it different from procedure oriented programming ( c ) ?	which wire should does what factors ? do mark package programming are scope of competition ? community ? ?	2.9617443884793695e-09	0.07372353673723538
how important is seo ?	why is seo ?	how for	8.226034369557267e-09	0.12060301507537688
how do i become more positive ?	how can i be more positive ?	how can ?	0.1863913237232041	0.22115606589651654
how many active users does yahoo ! have ?	how many active users does my yahoo have ?	what yahoo even	1.7471709924551733e-09	0.05825242718446602
what is the best ifb washing machine service center in hyderabad ?	what is the best ifb washing machine repair center in hyderabad ?	which is ifb washing center ifb washing center are i best ifb repair of for ifb	0.22360679773553777	0.2586392292304317
are you more intelligent than most people ? if so , why ?	why do you think you 're more intelligent than most people ?	what are the most more necessary ?	4.7774374113079105e-09	0.1348314606741573
what are scientific theories/hypotheses that are not widely accepted but have some evidence ?	what are some crazy scientific theories/hypotheses that actually have some evidence to them ?	what your interview facts french	1.1688396473440543e-09	0.014571948998178508
do muslim women feel oppressed by the strict rules on them ?	do muslim women feel oppressed ?	is universities ? like ?	5.78930067221365e-09	0.026755852842809364
will snow be present in rohtang pass in the month of october ?	can i expect snow in rohtang pass in the month of october ?	is be fresh be www.midnightexpressions.wordpress.com 's life it back forward lottery lottery standard mining ?	3.0860669990287532e-09	0.030360531309297913
why is n't bhutan a part of india ?	is bhutan part of india ?	why the best commercial ?	8.187307527300217e-09	0.08579088471849866
what are the risks of losing 25 pounds in 1 month without a diet plan ?	is it safe to lose 25 pounds in 1 month ?	is the correct a of 1 pounds lot complications ? pounds in of losing other pounds it of of one ?	0.21821789022534133	0.21418282533728802
what do peoples of other countries think about india and indians ?	what do people from other countries think of india ?	what does the view some of intelligent ?	5.700238056112239e-09	0.1573969459530083
will digital india be successful ?	is digital india mission going in right direction ?	what is india go india in be government in india & between way reservation issue whole ? the rate india as finding modi ? ?	2.8867513458302535e-09	0.1084010840108401
who is donald trump 's base ? why is he popular ? why are people voting for him ? why do people like and support him ?	i like donald trump however he has admitted to some deplorable behaviour so why do people still support him ? what would turn supporters against him ?	who and donald	7.501172393381477e-12	0.042872454448017155
is nuclear energy considered be renewable or non-renewable ?	is nuclear energy `` renewable energy '' ?	is nuclear nuclear reactors energy renewable or out ? isis video nuclear energy indian slaughter exist ? the energy renewable energy considred renewable energy renewable why are capacitor economy the most renewable desire nuclear that its nuclear matter	0.14111928108000185	0.22578677052539664
what are good pick up lines ?	what are some good pick up lines that work ?	what does you ? ? for the best 's be the best ?	3.5805743699102604e-09	0.05693950177935944
what is that good logical reason behind scrapping the 1000 rs . note and introducing the 2000 rs . note ?	what is the reasoning behind launching the note of rs 2000 in india ?	why it from indian 500 or in the about after rs by and how the new of the ? of the	4.0824829042449625e-09	0.11247803163444639
what is the expected cut off for the ssc cgl tier 1 2016 ?	what could be the cut-off for ssc cgl tier 1 2016 ?	would previous	4.764448008373334e-18	0.0
what are the best ways to get more followers on instagram ?	how can you get 5k followers on instagram ?	how can i followers followers	0.17402435942550276	0.17568240290880582
on what site can i ask doctors questions online ?	what 's the best way to ask a doctor a question online ?	why do i most most ask about talk home people do interesting stuff questions	4.059989714404599e-09	0.125
what are some best techniques or exercises to increase my brain power ?	what are the best brain exercises ?	what are some techniques science good great emotions love getting to reduce weight ?	0.2567762954875012	0.12878854143739485
what are good books about the history of fashion ?	what are the best books to read about the history of fashion ?	what do some people smart your for some secrets ? do some ?	3.580574369634832e-09	0.0657688019778918
what are some of the easiest languages to learn ?	what is the easiest spoken language to learn ?	what is the for website to out in for any do to is some the best best to learn resource is the best requirements today ) ? ? body is the best learn	0.14101901870010153	0.17209902244704137
what is genetic drift ?	what is genetic drift ? what are some types ?	how does einstein signs 's and	1.8257418580158344e-16	0.0682385231460465
why do i get goosebumps when i listen to music ?	why do you sometimes get goosebumps when you listen to a song ?	why does it least viewed	2.1297646960674127e-09	0.10748307663009421
which is the best sap hana online training ?	what are the best sap hana online training programs ?	which is the sap hana to sing ? sap prepared sap best sap /	0.392232270247274	0.333603502721695
i forgot my facebook and email password . how can i log into facebook ?	i forgot my facebook password . i dont wan na change it , how could i recover the current one ?	my major iphone . by them , improvement ? password password can i get account i am cause ?	0.13766284220162398	0.14154997673135933
how much black money will the government get back after demonetization ?	how much black money is unearthed through demonetization ?	what is the ?	4.530038590756525e-09	0.03970223325062035
what are most dangerous places in the world ?	where are the most dangerous places in the world and why ?	what is the best time online series ?	6.459215935396237e-09	0.14420879762570854
can we use laser as street light ?	can we use laser source as street lighting ?	will are apple see strongly ?	4.136895448977816e-09	0.025974025974025972
what is the jewish view on jesus ?	what is judaism 's view on jesus ?	call ?	1.1132726913181444e-09	0.032
how do i find love in life ?	how do i find a love of life ?	how i do you prefer ? love life meaningful ? love 2017 in ?	6.201736729000405e-09	0.30303030303030304
how do i hack android games ?	how do i hack android games ? i have rooted device !	can i hack a follower for the hacking is and 4 ?	0.15075567226318493	0.1280043705189007
how would i dress in workout attire like it 's the year 1990 if i 'm a guy ?	how on earth would i dress like a workout guy from the year 1990 in the summer ?	how a guy how can do workout compare with a 'm i	0.1293127711203326	0.21249933470651333
can bacteria infected by a virus ?	can bacteria get infected by a virus ?	can i distinguish of fully encryption ? encryption in their frequency any system located of cloud a jewish limit and ?	2.6726124189937955e-09	0.06857142857142856
why did the nazis hate jewish people to the point of committing genocide ?	in layman 's terms , why did the nazis hate the jews ?	is a the other between this : killing the a 's the want entirely	4.0599897141146e-09	0.08781148492826542
what is the difference between reference and bibliography ?	what is the difference between reference list and bibliography ?	what 's is my difference between uniform random and and ?	0.23354968322616365	0.2716846966117948
what is a critical analysis ?	what is critical analysis ?	which is the really mechanics theory ?	6.900655592355585e-09	0.10237682883792912
is love important in life ?	what is love ? what importance in my life ?	what bible of life ? life ?	0.3086066998764235	0.15079912807758566
what powers does the vice president have ?	what powers should the vice president be given ?	what did stronger americans in under jim republic powers crime ? the reasons in 3/4 of the powers of modi are the ?	2.8116077854526447e-09	0.11136890951276102
what is it like to have amnesia ?	what was it like to have amnesia ?	how did	3.520477361430895e-17	0.022857142857142857
what is the biggest mistake you ever made at work ?	what is the biggest mistake you have ever made at work ?	what are have you mistake was the you come have are you made you choose to in the significance of mistake that made ?	3.5610615579079957e-09	0.24347692468965365
how do you make easy money online ?	what are ways of earning money online ?	how can i earn ?	5.488116358607818e-09	0.21026047976493992
what are the side effects ( positive and negative ) , if any , of masturbation ?	what are the ill effects of excess masturbation ?	what is wrong effects of	0.17402435942550276	0.24073147938275058
which country in the world has the best education system and why ?	which country have an amazing education system ?	what has like a trump about most which is the system and your potentially have for media india , in	0.13572417850069451	0.1265244270464311
what will you do in the last day of your life ?	what will you do during the last 24 hours of your life ?	what 's your brief who of of paper last of your old ? life 'd on life effects to a	0.1256561724810606	0.21032513882243928
how does the embedded ngc technology of the rs . 2000 note works ?	will rs . 2000 currency note really come with a gps chip ? or it is just a rumor ?	does the currency ?	0.047391796026267544	0.07865057273080342
how can you learn to write in korean ?	what are some tips for learning korean ?	does the learn to india in ?	0.2675243277994909	0.15861493654502154
do long distance relationships work ?	can long distance relationships work out ?	how long a relationship long black ?	6.900655591369778e-09	0.16105583560036588
who is the best doctor/dermatologist for hair fall treatment in bangalore ?	who is best doctor for hair fall in bangalore ?	how can i cure for anxiety best ?	5.700238056112239e-09	0.11546391752577319
what is a good way to become a good software developer ?	what is to be done to be a good software developer ?	how do i i software with analysis software developer in in which will become the best great great and	0.09365858115310313	0.23431571375360663
what should i do to get rid of my huge stomach ?	how can i get rid of chub around my stomach area ?	how do i get married ?	0.15018615290247755	0.1446271379918576
what are the best digital marketing courses for mid-senior level marketing managers ?	what are the best online courses for digital marketing ?	which online course ?	2.88059797941122e-09	0.18902931567976664
would stricter gun control laws have prevented recent mass shootings in america ( newtown , purdue , etc. ) ? which laws would have made a difference ?	how would stricter gun control laws prevent someone who does n't have a criminal background from purchasing one and committing mass shootings ?	does knows and knew kinetic to ?	8.595336439215003e-10	0.04153686396677052
what are the best websites for which to write articles ?	which is the best website to write articles ?	what are the best websites in 2016 when the best website 's the	0.43852900961837615	0.2575285982855921
what are some of the experiences you would like to share that happened while travelling in delhi metro ?	what happened to you in delhi metro ?	what kind metro ? ?	0.21255383258936583	0.16857934079658998
i need a free hashtag tool to know the avg follower engagement by influencers who tweeted with a specific hashtag . does anyone know that tool ?	i 'm looking for a free hashtag tool to know the most active users who posted tweets with a specific hashtag . does anyone know that tool ?	what are the 8 learning 8 ? i i	8.735854966825789e-10	0.040489344909234413
which area in the world is best for property investment ?	which is the best country to do property investment ?	what has been the cheapest available become the be very world	4.2640143263175525e-09	0.09322265307050832
what are complex sentences ?	what is a complex sentence ?	what are some really of it are some of examples of math	0.12309149096860895	0.0923033163328165
how do you make money with quora ?	how can you earn a living on quora ?	how do i how do i make it important programming ?	0.19069251783091612	0.22758398594386295
who are the most underrated actors and actresses in bollywood ?	who is the most underrated bollywood actors ?	who are some of actors influential bollywood actors underrated romantic country	0.30151134452157297	0.2852642463758286
which are some truly romantic movies ?	what is the most romantic movie ?	what is the songs	0.3340135924679607	0.1301309781449025
how do i enhance my english ?	what the best way to improve english ?	how is why self-studying but i get a a research level ... well？ ? learn fluent as my english a speaking	0.1091089451126707	0.20928899559757844
what color can describe people 's fears ?	what is the color of fear ?	what ? ? ?	6.09822597026799e-09	0.08040201005025127
do ghosts really exist ?	is there any ghosts in real life ?	how are ghosts scientific ghosts real encountered really an scientific profiler so world that ghosts to the joy can there still ? exist ? to ? forward living verifiable evidence live ? exist fake existence	0.07100716024761407	0.22307218197296447
how powerful is a human brain ?	how powerful is human brain ?	what person ? brain brain depends ?	6.900655591369778e-09	0.13445886355045988
how do i get rid off from porn addiction ?	how can i stop my porn addiction ?	what do i get get `` porn	0.3783365326387855	0.21089168301206423
how are gay rights in india ?	what is the current state of gay rights in india ? is it legal or illegal or legal in delhi only ?	can is homosexual	3.403024417548223e-09	0.010973936899862827
how do change my diet ?	what is the best way to change my diet ?	what converted ? ? some requirements ?	6.900655592355585e-09	0.09436997319034854
why there is gender inequality in india ?	what are the causes of gender inequality in india ?	why tv work subjects the life ? preferred for the of the jinns and	4.688072309037213e-09	0.0898876404494382
how would abolishing rs . 500,1000 notes help in stopping the production of black money and curb corruption ?	would banning notes of denominations 500 and 1000 help to curb the black money in system ?	how do the effects of ? denominations rs does does corruption corruption money note banned ? 500 1000 rupee notes like 2000	4.87950036451559e-09	0.17932752179327527
how many religions in numbers are present in india ?	how many religions are in india ?	can it ? , this religions movies ? in enough india in to religions do some religions	4.287464628302636e-09	0.21777110943747674
what is the best website to learn coding for free ?	what are the best free websites to learn coding ?	which are the best language english platform download new sites for free source	0.31008683644817453	0.2280765052899392
how do i hire a mini truck in bangalore ?	what is the best way to rent a truck in bangalore ?	how should a truck ?	0.16452068752687485	0.15724815724815727
how do i know who visited my facebook profile ?	how do i see if someone visited my facebook profile ?	does who viewed ?	2.88059797941122e-09	0.09360215916279145
which weighs more , a normal egg or boiled egg ?	which one is heavier - boiled egg or normal egg ?	goliath pak really national peacock occuring detainer defense defense criminal multiplied pitcher hat defense criminal elbow difficulty elbow presidents presidents 20k pak seven presidents resolve presidents 20k massacres radius presidents libya presidents hat defense goliath pak grant hat nuclear besides presidents democrat presidents defense goliath presidents fuck presidents 20k pak labeled peacock presidents presidents presidents genuine downing eighteen downing defense criminal dropped democratic national presidents presidents presidents genuine downing defense goliath pak inspired/authored 20k pak natural peacock indo pak defense goliath defense goliath pak defense goliath downing democratic nominee elbow presidents defense goliath chekhov pitcher ? goliath presidents hat	3.2104755355066553e-10	0.006349206349206349
why are all my questions immediately being marked as needing improvement ?	why does quora always marks my question as needing improvement ?	why there anyway ? my quora not ) birthday get needs clarification ( questions do were right quora	4.042260417041042e-09	0.15126058515805585
how can i increase the traffic to a website ?	how do i increase traffic on my site ?	which can the easiest way i generate increase increase my best traffic lot 's some people ? ? jeenkart.com	4.524139283343915e-09	0.18779342723004697
are asian girls attracted to black guys ?	do asian girls like black guys ?	are really '' black guys medical guys do you prefer like asian than as ? in of age heard ? or during black girls boys summer ?	0.10675210253269501	0.31784403866041594
why ca n't i take this person out of my head ?	why ca n't i get that person out of my head ?	do you can do the conquer body ?	2.5630598377334847e-09	0.015779092702169626
how do i get good job as web developer ?	how can i get a good job in web development ?	how do i get i do i	0.3482088229883849	0.24074394262555432
why does quora mark my questions as needing improvement ?	why does quora always mark my questions as needing improvement , when i 'm saying all i know and i really need some help ?	what foundation don is are there mark	3.1786971178843654e-09	0.08408651558563039
who is stephen hawking and what happened to him ?	what happened to stephen hawking ?	how is the land from jon snow	4.879500363987508e-09	0.022792022792022793
how can i increase followers in quora ?	how can i increase my followers count in quora ?	how can i	0.1888756026959053	0.18061152018949883
what is the scope for placements in mechatronics ?	is there any scope in mechatronics ?	what is	0.08208499852129275	0.07320607847085447
should i study physics or engineering ?	should i major in physics or engineering ?	i buy in jee the out to apply business for i improve my to prepare cheats to cheats	2.556549962678361e-09	0.042105263157894736
what percentage of questions are yet to be answered in quora ?	what percentage of questions on quora are left unanswered ?	why should first when look write teenage ?	3.2910339761413517e-09	0.020304568527918784
shall i upgrade my iphone 5s to ios 10 final version ?	should i upgrade an iphone 5s to ios 10 ?	to spy completely ?	2.88059797941122e-09	0.040201005025125636
how do i know what interests me the most ?	how can i know what is my interest ?	tomorrow ? ?	1.7471709924551733e-09	0.02631578947368421
how should you deal with social anxiety ?	what are some effective ways to stop social anxiety ?	how does social how do i deal with and 3g social anxiety ?	0.3396831102161606	0.3352067803665443
how do i find cofounders in london ?	how do i find cofounders from london ?	how should i get commercial festival in thane ?	7.453559924119366e-09	0.19403704070776226
what is the worst thing that could happen if donald trump becomes president ?	what is the worst thing that could happen in a donald trump presidency ?	what is the clinton `` the do of you have the the do so get the most river to you the the best that	0.12038585308064412	0.10550140526769254
does smoking weed cause cancer ?	do people , who smoke weed get cancer ?	if weed for gain smoking unhealthy ? ?	6.459215935396237e-09	0.17500000000000002
should i go to the gym in the morning or evening ?	which is the best time to go to the gym , morning or evening ?	can i light '' through driving morning can stay car purchase ?	4.7673129454153526e-09	0.08849557522123894
what is the farthest object from earth visible with the naked eye ?	which is the farthest object from earth visible to the naked eye ?	why naked ? ? on my girl ? big end from taking earth gravity	4.688072309037213e-09	0.12284069097888675
what is the best quality a person can possess ?	which are the best qualities a person could have ?	which	1.2340980390156643e-07	0.02909090909090909
what was josef mengele like as a person ?	what was joseph mengele like ?	what 's biological person has you have made like a person really feel contradicted do ever ?	0.13558153612843557	0.19035714645825313
why does china want to control almost all the islands in the south china sea ?	what is china 's ultimate goal for waging a territorial dispute at the south china sea ?	when someone like more to it dispute japan between china in south north dispute is ? ? country ?	4.524139283343915e-09	0.12071330589849111
why do all my questions need improving on quora ?	what are the 3 best things you would recommend to improve your questions on quora ?	why do people	0.055986791708372015	0.13361389147477634
what is the best way to stop hairfall naturally ?	how can i stop hairfall naturally ?	what is the world it possible act	0.37796447289673796	0.08206148753728679
what should i do to get a job ?	how do i get job ?	how does i get a job	0.7071067809390603	0.37892582863743474
what should i do to marry a rich man ?	how do i marry a rich man ?	what do your more entrepreneur ?	7.1653131032300366e-09	0.10638297872340426
why is watching and playing snooker different ?	why ’ s watching and playing snooker different ?	why there the to youth incorrect but ? if from more ? english ?	3.31496772041309e-09	0.08602150537634408
is there any way to travel faster than light speed ?	is it possible to travel faster than light ?	is speed ? not be ?	0.1918018354745145	0.12678982838692057
how would the google pixel smartphone compare to the samsung s7 edge or iphone 7 ?	what do i buy , an iphone 7+ , samsung galaxy s7 edge , or google pixel ?	which lasts them ? for that	1.0904738010345271e-09	0.012461059190031154
if a modern person ; went back a couple of million years , and met an early man , what would they think of you ?	if a modern person ; went back a couple million years , and met an early man , what would they think of you ?	is live have today back next at moving for ?	1.0518456619717553e-09	0.037252619324796274
how should i earn money online working from home ?	how do i make money from home ?	what do ways we get money online work done online engineer online ? ? can happened of to make it like easily ? loose from	0.09999999999591673	0.18708407542487768
what does it take for a successful long distance relationship ?	do long distance relationships ever work out ?	what is the successful you my something a long does everybody feel long are a ?	4.999999999677084e-09	0.1971252566735113
how do i get a slim face ?	how can i slim my face naturally ?	what is the best in prison old english slim pricing english slim sick my ? boost my up ?	2.9617443886352513e-09	0.17243488740729218
why do people hate modi ?	why do some people love to hate narendra modi ?	why has the people see on the have you have ? the government hate ? hate most sound think reason .	3.0860669990912095e-09	0.19601529340187343
does j jayalalithaa deserve bharat ratna ?	do you think jayalalithaa deserves a bharat ratna ?	what is your review of	1.4988811889794536e-16	0.05970870775279069
how can i delete my instagram account if i forgotten the email i used ?	how do i delete an account on instagram if i ca n't remember the password or email ?	how email emails fake account of the account account account my instagram account account ? are if i delete my emails from instagram account primary and my ? how do i remove my pc `` my account from ?	0.23807595834181774	0.2628983213379139
why is porn considered taboo ?	why is porn considered bad and taboo ?	why do jinns ?	7.830277142529362e-09	0.11940298507462686
why is success a best revenge ?	why is success considered to be the best revenge ?	why as ? america and states ?	6.900655591369778e-09	0.108843537414966
what do i start with for learning machine learning ?	where do i start learning machine learning ?	what are best usual books should you ? and start to i start learning ?	0.26726124189397066	0.24643191690526234
is our universe just a computer simulation ?	is our world a computer program ? why ?	is to person ?	4.749303160991089e-09	0.04938271604938272
how di we define computer crime ?	how do we define cyber crime ?	how do to steal by ?	0.26768102474255034	0.1924398013401073
when/how did you realize were not straight ?	how did you realize you were gay ?	when/how end he divided you happened first realize you knew what you spend	0.16012815379225645	0.2641206115390453
