original (cond)	sample (pos)	generated (neg)	BLEU	METEOR
why is nikola tesla not taught in school ?	why has nikola tesla been ignored in school education ?	why is the related ? international the people told a ?	0.16514456475319042	0.11756190871341142
how should one change their diet to lose weight ?	how can i efficiently lose weight ?	what are i improve my exercise expecting ? weight use	5.773502690709485e-09	0.12461059190031153
how do you get mildew smell out of carpet ?	what are some of the best ways to clean mildew from a carpet ?	how a mildew smell if	0.16452068752687485	0.19757333061418528
where and when will cbse private candidate forms be available ( 2016-17 ) ?	when will the forms for cbse improvement exam 2017 will be released ?	hlo mohit own key time ? us out for neet private firm with the possibility of the minimum banned ? open to the possible based ?	2.48069469168685e-09	0.04644412191582003
how can i write a letter to mr. narendra modi ?	how do i write letter to our prime minister narendra modi regarding my problem to share ?	how do get letter a ? ( used in	0.2110128333603988	0.14333916154749618
how do i get rid of visible fat on my chest and belly ?	what is the way to reduce the fat on belly ?	how do i get weight ? remedies and when cheek muscles my my the over fat , thighs the easily 7 whats are some and arm best ways to belly ? to get the slim pricing that old should i get rid effectively exercises i get rid fat seed , ? when	0.1565560727682472	0.24827362300580014
why quora has word limit for question and question descriptions ?	why is there a sign limit on quora for questions ?	donald limit than seen the word write opinion upvoted word limit problem and mentally question details	0.12909944486524297	0.1573675111517455
what are some of the best ways to clean a otterbox ?	how do you clean an otterbox ?	what should i provide ? way up good up best fitness and	4.7673129454153526e-09	0.09708737864077671
is it true that hinduism is not a religion but philosophy ?	is hinduism neither a religion nor the ways of [ after ] life ?	are religion do is religion some sound religion ? religion fulfilling morals false by ) seem to relativity knowing word the still a	3.143473067169879e-09	0.11684809570691505
what ’ s the easiest most painless way to die ?	what is the most painless way to do a suicide ?	what do some of	2.243411962079365e-09	0.08533333333333334
how will long distance relationship work ?	can you help me with tips for a successful long distance relationship ?	what is my husband comfortable after to stay relationship to live partner accept i	2.344036154518608e-09	0.06347488299748606
how was google maps developed ?	how is google maps designed ?	if how many possibly did the	5.773502689875535e-09	0.10686456400742117
what are vertical and horizontal stressors ?	how do horizontal and vertical stressors compare and contrast ?	what are untold ? ? for area released lessons used ? washing sclerenchyma of evernote ? come the best importance time at learn spring or is the sigma	0.06299407883257979	0.06890518042842622
movie review : what is your review of aamir khan 's dangal ( 2016 movie ) ?	what is your review of aamir khan ’ s dangal ( 2016 movie ) ?	which movie get a army business . ) dangal instead of dangal for narendra modi will ? dangal narendra modi movie time ) worth time a ram about	2.8171808489925786e-09	0.12213740458015265
what are the differences between eccentric and concentric contraction ? what are some examples ?	what are some symptoms of eccentric and concentric contractions ?	what are the similarities and if the differences between the a in about a and how is the and and hard and different contrast to , and and ? like spoken ? and a different	0.16398401233340346	0.18327600127629268
how did prediction algorithms used for the us presidential election go wrong ?	why were the prediction polls in the u.s. presidential election so wrong ?	what did the study on interview effects application medicine i block algorithms of the application ?	4.564354645581603e-09	0.09653092006033183
do you support donald trump or hillary clinton ? why ?	donald trump or hillary clinton ?	do n't next of getting	5.78930067221365e-09	0.05139186295503212
what are the difference between 32 bit and 64 bit processor ?	what is the difference between a 32-bit and 64-bit computer ?	what do i 64 search ?	4.34598208354969e-09	0.1029526599023078
how can i find the aim of my life ?	how do you find your passion and purpose in life ?	how should do i forward ?	5.928430235525634e-09	0.11991434689507496
what 's the best way to become a supreme court justice ?	what does it take to become a supreme court justice ?	where the modi decision making ?	3.548479511991478e-09	0.0628175519630485
what are the elements of life that make it complicated ?	what are the elements in your life that make it “ complicated ” ?	what ? daily features of	3.6888606617552455e-09	0.10900622686751192
which are the top ten best hollywood romantic movies ?	what are some of the best hollywood romantic movies apart from titanic ?	which is would inventions : movie , is best romantic movies preparing ) you watch hollywood are the best hollywood movies which is the earth movies of is the ? 50k hollywood have played updated ?	0.169030850940941	0.24867437758475394
what can be done to stop hair loss . ?	how can i stop my hair fall ?	what causes people wash ? ?	5.85045365006396e-09	0.10476190476190478
why are women 's olympic beach volleyball uniforms bikinis , while men play in long shorts and shirts ?	why do men in olympic beach volleyball get to wear comfortable shirts but women have to wear bikinis ?	what is male	1.971002329948456e-18	0.0
what has bible predicted ?	what predictions has the bible made ?	why is your to many was christians in a sat professor	9.534625891545801e-17	0.029865309400175823
how can we write a essay ?	how do i write an essay ?	what do be	3.403024417548223e-09	0.08888888888888889
what 's the point in being alive ?	what 's the point in me being alive ?	what work	1.1132726913181444e-09	0.029962546816479405
what are some of the longest words and their meanings in the english language ?	what 's the longest word in the english language and what does it mean ?	which was earth ?	5.835788602834484e-10	0.041694928305821076
my gmail is hacked . how do i recover the password ?	how do i recover my gmail account when the recovery phone is no longer in service and forget my old password ?	is it so , my gmail the gmail ?	0.1888225796432837	0.15752347027243535
how do i conquer the world ?	what would it take to conquer the world ?	i do ? possible than	8.209710382242107e-09	0.14184397163120566
how can i increase my typing speed fast ?	how can i increase typing speed ?	how can i speed ? wrist problem good a typing need by increase reading	0.33968311021818254	0.3961813876967618
what are the best phones under 15000 in india ?	which is the best mobile under 15000	which is the smartphones ? 50k to to ?	0.2982797722031009	0.10578674753956357
how did donald trump manage to win the 2016 us election ?	why did trump win the election ?	if native election for cheated ? will did election ? is spouse presidential elections win at trump election i	0.12091270834512809	0.26895390784649087
what 's new about the new 2000 rupee note that will help curb black money ?	how will the introduction of new 2000 rupee notes help in curbing the black money ?	what are move in ? you print money and 2000 rs 1000 introducing new 2000 money	0.15811388298832543	0.18160749542793786
is there any factual basis in evidence of psychic abilities ?	is there any scientfic evidence for psychic ability ?	what limit practice 2 limit and what percentage of scientific snakes ? the whole clockwise animal ?	2.7116307225687105e-09	0.03187250996015936
how does the government print money ?	how does a government decide on printing money ?	what do some of print amount like of print money print money or money by print money money & liver shirts crown the different india can real a print	0.07018624063189625	0.16393655532555557
how much does a full-arm tattoo cost ?	in the world of tattoos , how much does a full sleeve cost ?	is raise build your really	1.227180124627569e-16	0.0
when will the united states finally transition to universal health care ?	when do you think free universal health care is going to happen in the united states ?	what ?	1.506650749991273e-10	0.01785714285714286
what is it like to live in an israeli settlement on the west bank ?	what is it like to live in the west bank ?	how can i think supreme to be in south the impact it like denomination amount of the become ? india ?	0.11952286092760558	0.20585437259486092
what can i do to increase my iq ?	how to increase iq level ?	how	6.737946988978591e-06	0.097165991902834
what is the differences between exceptions , and software interrupts ?	what is the difference between exception and software interrupt ?	what is the difference	0.2231301600275678	0.1827771050436471
newtons third law ?	what 's newton 's third law ?	what is an ?	1.2909944480365176e-08	0.05992509363295881
can electors of the electoral college vote their conscience ?	can the electoral college vote for anyone they want ?	do best supposed to electors candidates ? electors who ?	4.714045206941321e-09	0.07881773399014778
why do girls wear bra ?	when do girls wear bras ?	why are of ?	7.830277142529362e-09	0.17584680662438043
how cold can the gobi desert get , and how do its average temperatures compare to the ones in the kalahari desert ?	how cold can the gobi desert get , and how do its average temperatures compare to the ones in the great basin desert ?	how cold do desert	0.0049950585517626435	0.11973693713870442
how does one make reading interesting ?	how do i make reading interesting ?	how why can you artist english？ ? or you if you describe our mail float ? dated way meet my person your own alternative at a strong if you	1.5694120513807777e-09	0.09483381606475924
how can i get a job in tesla as a mechanical engineer ?	how do i get a job as a mechanical engineer in tesla ?	how can learn at mechanical from mechanical a mechanical common advanced how can i just an commercial engineer from engineer ? ?	0.24618298194720895	0.22791677219239576
what is the best book for core java for beginners ?	which is the best book for java ?	which is the best book and question learning for learning java ? ?	0.5063696835012589	0.45343401380368387
how can you kill wolverine ?	how could you kill wolverine ?	how do everyday	4.749303160001652e-09	0.10389610389610389
how do i start learning c language ?	how should i start to learn c language ?	how can i learn school	6.721542363805207e-09	0.14358974358974358
what are coplanar forces ?	what is coplanar force ?	which made ? state for	7.071067808860277e-09	0.09863139516393439
how do you solve the following recurrence using substitution method ? [ math ] t ( n ) =t\left ( \left\lfloor\frac { n } { 4 } \right\rfloor\right ) +n [ /math ]	how do you solve the following recurrence using the substitution method ?	my better	4.764448008373334e-18	0.0
as a fresher how can i be the penetration tester ?	is there a way to `` safely '' and legally `` train '' into becoming a penetration tester ?	how do i study video for penetration	4.772739233951095e-09	0.1670778970283756
what are some conspiracies that turned out to be true ?	which is the most unlikely conspiracy theory which turned out to be true ?	who select us turned up ratio bottles saw the ? most active on j.	4.688072308702351e-09	0.11829944547134937
what are the bitter truths about doing mba in the us for an indian ?	what are the sweet and bitter truths about ms in usa ?	what is be done in being	3.00372305804955e-09	0.06192369845102463
what are some of the best technology inventions of 2016 ?	what are the best technology things in 2016 ?	what are some of best 2016 the supplements ’ literature	0.48304589148865984	0.2704962578067547
why do all celebrities use iphones ?	why do so many celebrities use iphones ?	why are n't obsessed between high coolest similar what prefer names in italy ?	3.31496772041309e-09	0.12297664623401262
why is the sun so big ?	why is the sun big ?	what they do be a alternate of the yes far god ? feel does nazi and ?	2.7116307225687105e-09	0.052805280528052806
why modi banned rs 500 & rs 1000 notes ?	why modi is putting a ban on 500 and 1000 notes ?	why drawbacks of the right new reason gmail	3.2910339761413517e-09	0.04838709677419356
what is the fibonacci sequence ? why was it created ?	what is the fibonacci sequence ?	what is take , ? anything does between 90s of driving and we one of	0.11952286092518667	0.1067893035325012
how can i find my lost phone by tracking ?	can i track a lost phone ?	what do	5.804285908809378e-17	0.04199078097126548
how do l calculate cgpa by marks ?	how do i calculate cgpa ?	why historical ?	4.749303160001652e-09	0.03088803088803089
how can i make my app go viral ?	how do i make my app go viral ?	how can you make public apps	0.1918018354745145	0.1912389945044069
what are some good post-apocalyptic movies ?	what are the best post-apocalyptic movies ?	what are some india ?	0.4239476211681309	0.13042175072281925
if universe is expanding without a limit and dark and vacuum energy are created as it expands ?	if dark and vacuum energy are created with expansion is there potential energy that transforms into these types of energy with expansion ?	if of a vacuum gravitational potential of created or gravitational than infinite , human expands is the fastest created least for how can be created	3.651483716552006e-09	0.13995196748721445
what is means love ?	what 's true love ?	what it love ’ actually ? is of like the ultimate what is the ultimate of is 's	0.12782749813391808	0.2321649417028673
can i make money online ?	how do you make easy money online ?	how just online ?	0.30326532969204834	0.20622799677637396
how do you discipline and motivate yourself into studying ?	what are the best ways to discipline yourself in school ?	what do i tips for salary language introduce higher a highly each language decide i motivate a study in ?	3.627381250363917e-09	0.1106719367588933
how do i stop my miniature pinscher/chihuahua mix to stop humping my furniture ?	how do you stop your boxer/pitbull mix from humping your furniture ?	how do stop my ?	0.17437038534901722	0.15823459438804816
what are some tv shows similar to black mirror ?	could you reccomend a tv series that 's similar to `` black mirror '' ?	how is the actually	6.441212897812026e-17	0.0
how can i improve my english in all aspects ?	what can i do to improve my english speaking ?	how are good new my ?	5.134171188528962e-09	0.1527660772472129
how does a pressure sensor work ?	how do pressure sensor work ?	how does a keep up compare to fix take bad of affect does examples ?	0.19518001457623	0.19397752772480223
are fighter jets air conditioned ?	are fighter plane cockpits air conditioned ?	does all india as fighter still stops harm jets	5.270462766325093e-09	0.1563517915309446
should gandhi ji be replaced by some other personality from indian currency ?	should gandhi be replaced from indian currency note ?	how one be the ban looking ban steps of what are the be narendra pm ? think which	2.556549962678361e-09	0.03485838779956427
where do i find a simple to understand solution on how to lose weight ?	which are the best ways to lose weight ?	how should i they improve weight months ? current ?	6.666666665962964e-09	0.18597924395858823
how do you go about finding a career mentor ?	how would i go about finding a mentor ?	how should i find a advice to the best ?	6.666666665296299e-09	0.23498829639751298
is there any other website similar to quora ?	are there other websites like quora ?	what use windows to do the ? photo ? its to follow in to read which is there have similar quora is promotion similar websites need for profile accounts ?	0.08969937018144897	0.2533384726502679
what is the worst food you ever cooked or ate ?	what is the grossest food you ever ate ?	which is the worst first to you start	0.3335524766312959	0.15790850221196093
how do we know we are not living in a black hole ?	does our universe exist inside a black hole ?	how do i stop something here ?	0.20084075455651398	0.13139272150322456
how do i get call girls in hyderabad ?	where i get call girls in hyderabad ?	can i girls in the placement from phone after . , campus ?	0.16012815379225645	0.19403704070776226
what is the best way to learn networking ?	what is the best way to learn how networks work ?	what are i learn ?	5.503133441363796e-09	0.1622306748834672
how does the embedded ngc technology of the rs . 2000 note works ?	is the new 2000 rupee note really implementing ngc ( nano gps chip ) ?	is it , the ways does in india of to	4.468800305985678e-09	0.09959874844313514
an honest question . is quora biased against donald trump and pro clinton ?	why is quora biased agaist donald trump . ?	what is it is sign of a question no and any from quora ? ? idea and clinton ? big 500rs note	0.11396057645433466	0.15234379431268325
what is a pil ?	what is pil ?	what is sense ? ever discover a ?	0.26726124187663064	0.2154273258251224
why do people use vpn ?	why do i need a vpn ?	why do year ?	0.30326532969204834	0.23871349402875908
is facebook a waste of time and also unproductive ?	is using facebook is waste of time ?	saying all the best	1.0619764713730698e-16	0.0
have you died and come back to life ? and if so , what did you see/experience while dead ?	who has physically died and been brought back to our physical life ?	if i will was caught up , should you caught trump it do i died 've the worst thing he from have it of thing will happen n't recovered before died back happened , has the child because wednesday the ?	2.208630521442389e-09	0.11255700488097219
could quora be the tool for modern day illuminati ?	is quora a project of illuminati ?	in ?	1.8354763662658024e-09	0.03524229074889868
which are the great examples of presence of mind ?	what are some great examples of presence of mind ?	what are the smartest people presence ?	0.3178697117884365	0.15346813919400312
what is the best way to avoid questions needing improvement on quora ?	what should i do to improve my questions on quora ?	why by ?	8.970274974036499e-10	0.019704433497536946
how do accelerators make a profit ?	how do accelleraters make profit ?	how do required make equity opportunities and accelerators in a win	0.21320071633525958	0.2994838108993358
should india take some aggressive step against pakistan now ?	should india declare war against pakistan as they are spreading terrorism in india ?	what other object succeeded am stops see to support our hindu circumstances ?	2.3443930914526333e-09	0.024273673772930097
what are your life 's worst regrets ?	what is your worst regret in life ?	what are some worst in moment 's s life ? life biggest regrets ? in ? tuesday that your life ? of the worst mental regrets and had lived moment first and	0.19050019049423664	0.33607147167167634
what can we do to improve the indian education system ?	how can indian education system be reformed ?	how do you improve the serve ? indian education system in application system in with style them	0.29704426287498314	0.35637352581604564
is trump 's personal notebook apple or windows ?	is trump 's personal laptop apple or windows ?	is the string + pi microsoft setting weigh ) ? ” ?	3.892494720468497e-09	0.03883495145631068
what are the best games that can be played on a laptop without a graphics card ?	what are the good games that can play without graphics card ?	what are there the list of internet of the any ca offline games asked	0.14824986332122378	0.10574329103001437
how should i approach a career in animation ?	how do i start my career in animation ?	how do i earn ? 300 how do i approach young ?	0.33709993120225257	0.17330418576773712
what is your score in kvpy sa 2016 ( aptitude test ) ? what is the expected cutoff ?	how was the kvpy sa 2016 ? what is the expected cutoff ?	what 's the expected kvpy 2016 kvpy 2016 off the removal off ? marks be the expected ? like	0.15294382256405162	0.23068250424592257
what are the best strategies for preparing for the lsat ?	how do i prepare for lsat ?	what are the to write started and the prepare for	0.4046555949795809	0.1796664982484741
what are the best c++ books ?	what are the top c++ books ?	which are some best c++ write ? my books for the c++ ?	0.1961161351224697	0.37644946099811827
why has star sports decided not to broadcast epl ( 2016/17 ) on their sd channels ? how can we make it not happen ?	why is star sports not broadcasting premier league in its sd channels ?	is india is n't name as april of in rio , , what movie has	3.7796447298312975e-09	0.027729636048526865
atmospheric science : how is rainfall measured ?	how is rainfall measured ?	how should	4.9893420529863676e-09	0.11707317073170731
can a person increase his/her height even after 20 ?	is there any way to increase height after age of 20 ?	do people as adult taller like it increase height entire effective on a else earth if increased on girls 19 to a , firm low increase able to have traffic allowed explanation as increase parents or our and millionaire calculator access my increase ability platforms younger height caused	0.042107596052439404	0.11821019855664743
what is the best way to start learning c language within a month ?	best way to learn c language ?	how do i learn c language collection for time ? in complete language c ?	0.19518001457623	0.24622147526924
what is the best video game ?	what are the best video games to play ?	what are are the best best video free ?	0.5773502690573166	0.32191216768290015
how do i to start a new business ?	how can i start my business ?	how does i make new language ? ?	8.451542546153264e-09	0.19697718021539196
how do i reduce my sexual desire ?	how can i curb my sexual desires ?	how can my desire about ? should a a any it to touch before to kill an their ?	0.12091270834512809	0.19710105431679012
if a mosquito appears to fly at its normal speed inside a moving vehicle with closed windows , is it really flying at its normal speed or is it flying at a speed relative to the speed of the vehicle to appear normal ?	does an insect flying inside a vehicle need to keep with the speed of it , or if in front , fly faster than the vehicle ?	my gravity track it not track possible energy share stops fat . on height puberty ? due can wo i already but camera fat flight puberty ?	1.687898945013213e-09	0.03787878787878788
what do you look at before investing in a startup ?	what are the most important things vcs look for before investing in a startup ?	what companies job license would fully from 58 to search and just if would you citizens and ? look in your foods you invest think 's your weight ? like your corporate of investing officers a m your brain money money do an	2.1046802246600357e-09	0.17364341085271318
what algorithm does quora follow for arranging the answers of a particular question ?	how does quora sort multiple answers for a question ?	how we add website ?	3.678794410150938e-09	0.07256235827664399
which are the positive benefits of banning existing ₹500 and ₹1000 currency notes in india ?	how will discontinuing ₹500 and ₹1000 notes affect india 's economy ?	what is the notes ? notes 1000 in the india of 500 and 1000 on ? affect due to ? ₹1000 ? notes india ?	0.12247448713415794	0.25827004323649727
how introducing 2000 rs notes which is of higher denomination than the current highest denomination 1000 rs notes will reduce the black money ?	how would demonetizing 500 and 1000 rupee notes and introducing new 2000 rupee notes help curb black money and corruption ?	what will will the money ? is you money self ? . denomination and 1000 rupee 1000 rupee notes and 1000 notes in what would help help and black money ?	0.33117581334941243	0.24445253046764676
can anime exist in a parallel universe of some kind ?	can anime exist in a parallel universe/multiverse ?	has already universe do real real life ? universe would do ?	3.892494720468497e-09	0.07256235827664398
why ca n't india produce quality fast bowlers ?	why india ca n't produce fast bowler like bret lee ?	is eat against feeling creatures to produce ? generated ?	4.714045207412725e-09	0.06299212598425197
can a happily married man fall in love with someone else and if yes what do honest men do then ?	can a happily married man fall in love with someone else and if yes , what do honest men do then ?	ladies ladies ladies asian arizona i ladies ladies ladies ladies ladies ladies ladies ladies ladies ladies ladies ladies ladies ladies ladies record 's that can ladies ladies record ladies married to stay record suppose woman attractive ladies ladies ladies ladies ladies ladies ladies say fathers say record ladies ladies ladies ladies christian less short record week ft. who ladies ladies ladies ladies ladies ladies ladies interviewer ladies ladies ladies ladies ladies ladies ladies ladies ladies ladies ladies ladies ladies ladies ladies ladies in pune ladies ladies ladies . .	6.189054227918096e-10	0.02582311168495804
how do you recover your gmail password ?	how do i recover a forgotten gmail password ?	what i reset my your gmail gmail does my gmail my ?	0.17407765594053212	0.1925687344311563
what is the best video making software ?	what is the best software for video production ?	what are the virus is your best video games for software softwares video games software software ? my pc games games ?	0.18609684207103389	0.2667114470113053
can a president elect ever be forced out ?	has a president elect ever been forced out ?	what are you ? would nicotine next	3.666833724565372e-09	0.04357198723332681
